{
  "$schema": "./SPEC_PIPELINE.schema.json",
  "spec_id": "spec-9df715e33efdedca",
  "version": "1.0.0",
  "user_request": "criar pipeline e2e-real a partir de https://example.com",
  "goal": "teste real de ponta a ponta",
  "approved": true,
  "created_at": "2026-10-26T23:16:33Z",
  "target": {
    "kind": "web",
    "uri": "https://example.com"
  },
  "skills_required": [
    {
      "name": "aidd-rea-web-saas",
      "role": "REA web",
      "mode": "reuse"
    }
  ],
  "pipeline": {
    "name": "e2e-real",
    "description": "E2E real",
    "steps": [
      {
        "id": "node-01-ingest",
        "skill": "aidd-rea-web-saas",
        "description": "REA",
        "depends_on": []
      },
      {
        "id": "node-02-factory",
        "skill": "aidd-orchestrate-pipeline-creator",
        "description": "scaffold",
        "depends_on": [
          "node-01-ingest"
        ]
      }
    ]
  },
  "install_dependencies": false,
  "notes": "E2E real aprovado"
}