{"$schema": "./SPEC_PIPELINE.schema.json", "spec_id": "spec-9df715e33efdedca", "version": "1.0.0", "user_request": "criar pipeline e2e-real a partir de https://example.com", "goal": "teste real de ponta a ponta", "approved": false, "created_at": "2026-10-26T23:16:33Z", "target": {"kind": "none", "uri": "", "path": ""}, "skills_required": [{"name": "aidd-rea-web-saas", "role": "Disseccao REA do alvo web", "mode": "reuse"}], "pipeline": {"name": "placeholder-pipeline", "description": "PREENCHER: descricao curta do DAG", "steps": [{"id": "node-01-ingest", "skill": "aidd-rea-web-saas", "description": "Ingestao e disseccao", "depends_on": []}, {"id": "node-02-factory", "skill": "aidd-orchestrate-pipeline-creator", "description": "Scaffold do pipeline canonico", "depends_on": ["node-01-ingest"]}]}, "install_dependencies": true, "notes": "Spec template. Nao orquestre com approved=false ou placeholders."}